Grocery, Therbal, Infusion Manzanilla, Te Verde y Diente de Leon 24 sobres , 24 gramos., 68
Grocery, Leche Deslactosada, Leche Santa Clara, 6 pack - 750ml/caja, 68
Grocery, Mister Natural Dátil, 250 g, 71
Grocery, Bonafont, Agua Natural, 6 litros, 2 Pack, 77
Grocery, Lala Leche UHT Entera con Tapa, 1.5 L, 10 Piezas, 79
Grocery, Cerveza Ambar Dos Equis 24 Pack Botella 355 Ml, 82
Grocery, Tuny Atun Aceite Standar De 140 gr, 83
Grocery, Cerveza Clara Amstel Ultra 24 Pack Botella 355 Ml, 89
Grocery, Satoru Vinagre De Arroz Para Preparar Sushi, Agridulce y Astringente - 275 ml. El empaque puede variar, 90
Grocery, Lala Leche UHT 100 sin Lactosa, Reducida en Grasa, 1 L, 12 Piezas, 93
Grocery, Sanissimo, Salmas con Nopal. 100 paquetes de 12 gramos cada uno, 94
Grocery, Cerveza Tecate Ambar 24 Pack Lata 473 Ml, 95
Grocery, Cerveza Premium Michelob Ultra, 24 botellas de 355 ml c/u, 97
Grocery, Pinalim Tea/Te de Pinalim Mexican Version- Pineapple, Flax, Green Tea, & White Tea - 30 Day Supply by SmileMore, 99
Grocery, Nestlé Crema para batir, 950 mililitros, 99
Grocery, Verde Valle Arroz Super Extra de 1 Kilogramo, 105
Grocery, Morama Harina de Almendra, 350 g, 109
Grocery, Bonafont, Agua Natural, 1.5 litros, 12 Pack, 111
Grocery, Heinz, Ketchup, 567 Gramos, 111
Grocery, Therbal Té, Surtido de Frutes 25 sobres , 45 gramos., 112
Grocery, Verde Valle, Queretaro Frijol Negro, 900 gramos, 114
Grocery, Cerveza Ámbar Victoria 24 botellas de 355 ml c/u, 114
Grocery, Alpura, 2000 Leche Clásica Natural, Paquete de 6, 1.5 litros, 115
Grocery, Sanissimo Salmas Tostaditas de Maíz Horneadas con Una Pizca de Sal, 100 paquetes de 12 gramos cada uno, 116
Grocery, Vodka New Amsterdan Citron 750 ml, 122
Grocery, McCormick Mayonesa #32, 725 g, 128
Grocery, Satoru Arroz Para Sushi, tipico harinoso, 700 gramos, 128
Grocery, Cerveza Premium Importada, Michelob Ultra, 24 latas de 355 ml c/u, 128
Grocery, Cerveza Ámbar, Modelo Ámbar, 12 botellas de 355 ml c/u, 133
Grocery, Boing Boing Jugo sabor Uva de 500 Ml, Uva, 500 mililitros, 140
Grocery, Tequila Don Ramón Plata Punta Diamante 750 ml, 146
Grocery, Cerveza Victoria, 24 Latas De 473ml C/u, 148
Grocery, Nutrioli Aceite Vegetal De 400 ml, 155
Grocery, Cerveza Importada Stella Artois 24 latas de 250ml c/u, 159
Grocery, Bonafont Juizzy, Agua Fresca Con Jugo Natural De Guanabana, 1 litro, 6 Pack, 165
Grocery, Miel Monk: Miel de Fruta del Monje sabor maple 250 ml., 170
Grocery, Pinalim Tea/Te de Pinalim Versión mexicana - Piña, lino, té verde y té blanco - Suministro de 30 días, 174
Grocery, Cerveza Bud Light 24 latas de 355ml c/u, 174
Grocery, Starbucks by Nespresso, Café Blonded Espresso Roasted, contiene 10 cápsulas de Sistema Original, 178
Grocery, Pepsi Black, Refresco Sabor Cola sin Azucar, lata de 355 mililitros. Paquete de 24, 188
Grocery, Vodka New Amsterdam Original 750 ml, 191
Grocery, Knorr, Caldo de Camarón, 8 piezas, 196
Grocery, Piñalim Té 30 Sobres, 218
Grocery, Lala Leche UHT Deslactosada Semi con Tapa, 1.5 L, 10 Piezas, 219
Grocery, Morama Harina de Coco, 340 g, 224
Grocery, Betty Crocker Chip Cookie Mix, Chocolate, 496 g, 239
Grocery, Crackets, Galletas Crackets, 5 Mini Rollos, 215 Gramos, 243
Grocery, Bonafont Agua Natural Bonafont, 1.2 litros, 12 pack, 247
Grocery, Isadora, Frijoles Refritos Bayos, 400 gramos, 259
Grocery, Sanissimo, Salmas con Chía, Linaza y Arroz. 100 paquetes de 12 gramos cada uno, 262
Grocery, Cerveza Clara, Modelo Especial, 24 latas de 473ml c/u, 265
Grocery, Starbucks by Nescafé Dolce Gusto, Blonde Espresso Roast 12 Cápsulas, 12 piezas, 273
Grocery, Verde Valle, Arroz Impegable, 750 gramos, 273
Grocery, Ginebra Diega Rosa 950 ML, 275
Grocery, Satoru Alga Marina Nori Para Sushi, Característico salado (alga marina), 10 piezas, 295
Grocery, Bragg Vinagre Orgánico de Manzana, 473 ml, 307
Grocery, , 310
Grocery, Saladitas Galletas, Sabor Salado, 42 paquetes de 12 gramos. 504 gramos, 325
Grocery, Lala Leche UHT Deslactosada Baja en Grasa con Tapa, 1.5 L, 10 Piezas, 331
Grocery, Bonafont, Agua Natural, 1litro, 12 Pack, 338
Grocery, Gamesa, Gamesa Harina Hotcakes 850 Gr, 850 gramos, 349
Grocery, Nespresso, Café Alto Intenso, Paquete de 30 cápsulas de Sistema Vertuo. Tamaño de taza Alto 414 ml, 357
Grocery, Verde Valle, Verde Valle Tipo Morelos, 900 gramos, 373
Grocery, Ginebra Diega 950 ml, 412
Grocery, Quaker, Avena Quaker Old Fashion 475gr, 475 gramos, 416
Grocery, Etnia 52, Café de Altura Sabor Avellana, Tueste Medio, Molido, 250 gr, 422
Grocery, La Lechera, Leche condensada, 387 gramos, 445
Grocery, Café de La Parroquia de Veracruz Café Puro Soluble, 100 g, 467
Grocery, Knorr, Caldo de Camarón granulado, 200 gramos, 479
Grocery, Nutrileche Producto Lácteo, 1 litro. Paquete de 12, 547
Grocery, Selecta Harina De Trigo De 1 Kg, 554
Grocery, Therbal, Té Surtido Aromaticos 25 sobres, 25 gramos., 560
Grocery, Capullo Aceite de Canola, 840 ml, 571
Grocery, Knorr, Sopa Mexicana Caldo de Camarón, 54 gramos, 579
Grocery, Clavel Leche Evaporada Lata De 360 Gr, Dulce, 360 g, 581
Grocery, Rosamonte Yerba Mate, 500 g, 596
Grocery, Lala Leche UHT 100 sin Lactosa Entera, 1 L, 12 Piezas, 612
Grocery, Leche Sabor Helado de Chocolate, Leche Santa Clara, 27 Pack - 200ml/caja, 639
Grocery, Vino Tinto Casa Madero 3V Cabernet Sauvignon Merlot Tempranillo - 750 ml, 642
Grocery, Verde Valle, Ajonjolí, 100 gramos, 663
Grocery, Coca-Cola Light, 24 Pack - 235 ml/lata, 664
Grocery, Leche Deslactosada, Leche Santa Clara, 12 pack - 1l/caja, 667
Grocery, Therbal, Infusion Abango con Propoleo 25 sobres , 25 gramos., 667
Grocery, Betty Crocker Cake Mix Devil´s Food, Chocolate, 432 g, 679
Grocery, Nescafé Clasico, Café Soluble, 225 g, 708
Grocery, Nespresso, Café Ispirazione Firenze Arpeggio, Paquete de 50 cápsulas de Sistema Original, 711
Grocery, 1-2-3 Aceite Vegetal,1 Lt, 717
Grocery, Bragg, Vinagre Organico de Manzana, 946 ml, 721
Grocery, Verde Valle Alubia Chica, 500 gramos, 722
Grocery, Bola de Oro Café Molido, Descafeinado, 1 kilo, 725
Grocery, Horley Té Chai, 15 g, 729
Grocery, Café Solo Dios Café en Grano, Sabor Artesanal, 1 Kg, 731
Grocery, Coca-Cola Sin Azúcar, 24 Pack - 235 ml/lata, 731
Grocery, PEÑAFIEL, Agua Mineral 1 l, Botella Pet, 12 piezas, 732
Grocery, Zucarmex Zulka Azúcar Empacada, 1 kg, 733
Grocery, Monk: Endulzante Natural Fruta del Monje 400 g., 733
Grocery, Chilito Sirilo Stevia 300ml (Paq 3 pzas), 733
Grocery, Café de La Parroquia de Veracruz Bolsa de Café Molido Orgánico, 1 kg, 735
Grocery, Coca-Cola Original, 24 Pack - 235 ml/lata, 735
