Grocery, Leche Deslactosada, Leche Santa Clara, 6 pack - 750ml/caja, 68
Grocery, Nespresso, Café Ispirazione Firenze Arpeggio, Paquete de 50 cápsulas de Sistema Original, 711
Grocery, Coca-Cola Sin Azúcar, 24 Pack - 235 ml/lata, 731
Grocery, Bonafont, Agua Natural, 1litro, 12 Pack, 338
Grocery, Coca-Cola Original, 24 Pack - 235 ml/lata, 735
Grocery, Capullo Aceite de Canola, 840 ml, 571
Grocery, Vodka New Amsterdan Citron 750 ml, 122
Grocery, Heinz, Ketchup, 567 Gramos, 111
Grocery, Betty Crocker Cake Mix Devil´s Food, Chocolate, 432 g, 679
Grocery, Chilito Sirilo Stevia 300ml (Paq 3 pzas), 733
Grocery, Verde Valle Arroz Super Extra de 1 Kilogramo, 105
Grocery, 1-2-3 Aceite Vegetal,1 Lt, 717
Grocery, Monk: Endulzante Natural Fruta del Monje 400 g., 733
Grocery, Zucarmex Zulka Azúcar Empacada, 1 kg, 733
Grocery, Therbal, Infusion Abango con Propoleo 25 sobres , 25 gramos., 667
Grocery, Café de La Parroquia de Veracruz Bolsa de Café Molido Orgánico, 1 kg, 735
Grocery, PEÑAFIEL, Agua Mineral 1 l, Botella Pet, 12 piezas, 732
Grocery, Verde Valle Alubia Chica, 500 gramos, 722
Grocery, Nescafé Clasico, Café Soluble, 225 g, 708
Grocery, Rosamonte Yerba Mate, 500 g, 596
Grocery, Morama Harina de Coco, 340 g, 224
Grocery, Lala Leche UHT 100 sin Lactosa, Reducida en Grasa, 1 L, 12 Piezas, 93
Grocery, Knorr, Caldo de Camarón granulado, 200 gramos, 479
Grocery, Bragg Vinagre Orgánico de Manzana, 473 ml, 307
Grocery, Saladitas Galletas, Sabor Salado, 42 paquetes de 12 gramos. 504 gramos, 325
Grocery, Quaker, Avena Quaker Old Fashion 475gr, 475 gramos, 416
Grocery, Bola de Oro Café Molido, Descafeinado, 1 kilo, 725
Grocery, Cerveza Premium Importada, Michelob Ultra, 24 latas de 355 ml c/u, 128
Grocery, Morama Harina de Almendra, 350 g (el empaque puede variar), 52
Grocery, Café Solo Dios Café en Grano, Sabor Artesanal, 1 Kg, 731
Grocery, Victoria 1.8 24 latas de 473ml c/u, 61
Grocery, Nutrileche Producto Lácteo, 1 litro. Paquete de 12, 547
Grocery, Cerveza Ámbar Victoria 24 botellas de 355 ml c/u, 114
Grocery, Alpura, 2000 Leche Clásica Natural, Paquete de 6, 1.5 litros, 115
Grocery, Vino Tinto Casa Madero 3V Cabernet Sauvignon Merlot Tempranillo - 750 ml, 642
Grocery, Horley Té Chai, 15 g, 729
Grocery, Cerveza Victoria, 24 Latas De 473ml C/u, 148
Grocery, Verde Valle, Arroz Impegable, 750 gramos, 273
Grocery, Bragg, Vinagre Organico de Manzana, 946 ml, 721
Grocery, Berry Nuts 30 bolsitas de snacks TO GO, un poco de cada uno de nuestros 7 sabores., 49
Grocery, Cerveza Premium Michelob Ultra, 24 botellas de 355 ml c/u, 97
Grocery, Sanissimo, Salmas con Chía, Linaza y Arroz. 100 paquetes de 12 gramos cada uno, 262
Grocery, Bonafont Juizzy, Agua Fresca Con Jugo Natural De Guanabana, 1 litro, 6 Pack, 165
Grocery, Coca-Cola Light, 24 Pack - 235 ml/lata, 664
Grocery, Clavel Leche Evaporada Lata De 360 Gr, Dulce, 360 g, 581
Grocery, Esquites Listos Para Disfrutar (Tradicional (Epazote con Chile de arbol), 4 Bolsas por Caja), 12
Grocery, Cerveza Clara Corona Light 24 botellas de 355ml c/u, 34
Grocery, Bonafont Agua Natural Bonafont, 1.2 litros, 12 pack, 247
Grocery, Nespresso, Café Alto Intenso, Paquete de 30 cápsulas de Sistema Vertuo. Tamaño de taza Alto 414 ml, 357
Grocery, Satoru Vinagre De Arroz Para Preparar Sushi, Agridulce, astringente, 275 mililitros, 1
Grocery, Leche Deslactosada, Leche Santa Clara, 12 pack - 1l/caja, 667
Grocery, Lala Leche UHT 100 sin Lactosa Entera, 1 L, 12 Piezas, 612
Grocery, Verde Valle, Ajonjolí, 100 gramos, 663
Grocery, Schweppes, Ginger Ale 1 L, Botella Pet, 12 Piezas, 55
Grocery, La Lechera, Leche condensada, 387 gramos, 445
Grocery, Heinz Mayonesa Chipotle, 390 g, 20
Grocery, Ginebra Diega 950 ml, 412
Grocery, Lala Leche UHT Deslactosada Semi con Tapa, 1.5 L, 10 Piezas, 219
Grocery, Herdez Granos de Elote, 400 gr, 58
Grocery, Etnia 52, Café de Altura Sabor Avellana, Tueste Medio, Molido, 250 gr, 422
Grocery, Mister Natural Dátil, 250 g, 71
Grocery, Café de La Parroquia de Veracruz Café Puro Soluble, 100 g, 467
Grocery, Leche Sabor Helado de Chocolate, Leche Santa Clara, 27 Pack - 200ml/caja, 639
Grocery, Nutrioli Aceite Vegetal De 400 ml, 155
Grocery, Isadora, Frijoles Refritos Bayos, 400 gramos, 259
Grocery, Cerveza Clara, Modelo Especial, 24 latas de 473ml c/u, 265
Grocery, Piñalim Té 30 Sobres, 218
Grocery, Miel Monk: Miel de Fruta del Monje sabor maple 250 ml., 170
Grocery, Gamesa, Gamesa Harina Hotcakes 850 Gr, 850 gramos, 349
Grocery, Therbal Té, Surtido de Frutes 25 sobres , 45 gramos., 112
Grocery, Knorr, Caldo de Costilla granulado, 200 gramos, 58
Grocery, Therbal, Infusion Manzanilla, Te Verde y Diente de Leon 24 sobres , 24 gramos., 68
Grocery, La Moderna, Macarrón, Pasta, 220 Gramos, 19
Grocery, Sinaloa Chilorio Pouch, 125 g, 6
Grocery, Knorr, Sopa Mexicana Caldo de Camarón, 54 gramos, 579
Grocery, Ginebra Diega Rosa 950 ML, 275
Grocery, Satoru Alga Marina Nori Para Sushi, Característico salado (alga marina), 10 piezas, 295
Grocery, Ghee Mantequilla Clarificada 500g, 4
Grocery, del Fuerte, del Fuerte Pure Tomate Brick 210 Gr, 210 gramos, 2
Grocery, Lala Leche UHT Entera con Tapa, 1.5 L, 10 Piezas, 79
Grocery, Ron Solera 23 Años Zacapa Gran Reserva 750 Ml, 23
Grocery, Cerveza Importada Stella Artois 24 latas de 250ml c/u, 159
Grocery, Agua Mineral sabor Naranja, San Pellegrino, Aranciata Italiana, 330 ml, Paquete de 12, 30
Grocery, Satoru Vinagre De Arroz Para Preparar Sushi, Agridulce y Astringente - 275 ml, 8
Grocery, Tuny Atun Aceite Standar De 140 gr, 83
Grocery, Morama Harina de Almendra, 350 g, 109
Grocery, Betty Crocker Super Moist German Chocolate Cake Mix, 432 gramos, 18
Grocery, Coca-Cola Sin Azúcar, 12 Pack - 355 ml/lata, 4
Grocery, Licor de Hierbas para Carajillo Sisi 1L, 38
Grocery, Morama Harina para Hotcakes, 400 g, 2
Grocery, Mix de Nueces con Fruta Tropical, 907 gr, 16
Grocery, Squirt Refresco Jugo, Toronja, 3 litros, 6
Grocery, Satoru Arroz Para Sushi, tipico harinoso, 700 gramos, 128
Grocery, Cerveza Clara Amstel Ultra 24 Pack Botella 355 Ml, 89
Grocery, Cerveza Premium Bohemia Vienna, 44
Grocery, Cerveza Ambar Dos Equis 24 Pack Botella 355 Ml, 82
Grocery, Cerveza Premium Bohemia Weizen 24 Pack Botella 355 Ml, 24
Grocery, Cerveza Clara Corona Light lata de 2 12 pack de 355ml c/u total 24 latas, 44
Grocery, Cerveza Tecate Ambar 24 Pack Lata 473 Ml, 95
Grocery, Cerveza Premium Heineken 24 Pack Botella 355 Ml, 64
Grocery, Cerveza Premium Bohemia Pilsner, 44
Grocery, Sidra Strongbow Red Berries 12 Pack Botella 330 Ml, 24
Grocery, Sidra Strongbow Rosé 12 Pack Botella 330 Ml, 24
Grocery, Sidra De Manzana Strongbow Honey 12 Pack Botella 330 Ml, 24
Grocery, Cerveza Artesanal Lagunitas Ipa/prohibida Venta A Menor, 13
Grocery, Cerveza Modelo Combo Premium Pack, 12 Botellas de 355ml c/u, 44
Grocery, Cerveza Clara Dos Equis Lager 24 Pack Botella 355 Ml, 31
Grocery, Cerveza Preparada Sol Clamato 24 Pack Lata 473 Ml, 22
Grocery, Cerveza Clara Corona Extra 24 latas de 355ml c/u, 34
Grocery, 12 Pack con 6 cervezas Colimita Lager y 6 cervezas Cayaco Lager Light, 9
Grocery, Cerveza Oscura, Negra Modelo, 24 Latas de 355ml c/u, 39
Grocery, Lagunitas Pils 4x6 Bot 355ml, 20
Grocery, Cerveza Artesanal Cajota Feliz Minerva, 24
Grocery, Cerveza belga Gulden Draak 8 pack mixto, 13
Grocery, Cerveza Bud Light 24 latas de 355ml c/u, 174
Grocery, Cerveza Ámbar, Modelo Ámbar, 12 botellas de 355 ml c/u, 133
Grocery, Cerveza Importada Premium Carlsberg 24 botellas de 330ml c/u, 6
Grocery, Cerveza Ámbar Victoria 24 latas de 355 ml c/u, 13
Grocery, Principia 12 Pack Mixto (12 botellas de 355 ml), 3
Grocery, Isadora Frijoles Claros Enteros, 454 gramos, 46
Grocery, Sabrosano Aceite De 850 ml, 51
Grocery, Satoru Vinagre De Arroz Para Preparar Sushi, Agridulce y Astringente - 275 ml. El empaque puede variar, 90
Grocery, Sabritas, Chicharrón de Cerdo Sabritas 115 g, 115 gramos, 27
Grocery, Starbucks by Nescafé Dolce Gusto, Blonde Espresso Roast 12 Cápsulas, 12 piezas, 273
Grocery, Whisky Buchanan'S 12 Años 750Ml, 31
Grocery, Vodka New Amsterdam Original 750 ml, 191
Grocery, EMPAQUE ESPECIAL - DUO PACK - MEZCAL AMORES ESPADÍN + MEZCAL AMORES ESPADÍN REPOSADO, 10
Grocery, Cerveza Clara, Modelo Especial, 12 botellas de 355 ml c/u, 12
Grocery, Vodka New Amsterdam Coconut 750ml, 25
Grocery, Carnation, Evaporada, 720 gramos, 17
Grocery, Nestlé Crema para batir, 950 mililitros, 99
Grocery, Tuny, Ensalada de Atún con Mayonesa, 135 g, 135 gramos, 18
Grocery, Starbucks by Nespresso, Café Blonded Espresso Roasted, contiene 10 cápsulas de Sistema Original, 178
Grocery, Bob´s Red Mill, Bob´s Red Mill, Polvo para hornear sin gluten, 397g, 397 gramos, 4
Grocery, Agua Mineral, Agua Ciel, 12 Pack - 355 ml/lata, 55
Grocery, Wellhouse Nuez de Castilla (Walnut), Nuez, 850 gramos, 21
Grocery, Therbal, Té Surtido Aromaticos 25 sobres, 25 gramos., 560
Grocery, Selecta Harina De Trigo De 1 Kg, 554
Grocery, Satoru Pasta para hacer Sopa Miso, Miso blanco, 200 gramos, 10
Grocery, Pepsi Black, Refresco Sabor Cola sin Azucar, lata de 355 mililitros. Paquete de 24, 188
Grocery, Crackets, Galletas Crackets, 5 Mini Rollos, 215 Gramos, 243
Grocery, Betty Crocker Chip Cookie Mix, Chocolate, 496 g, 239
Grocery, Boing Boing Jugo sabor Uva de 500 Ml, Uva, 500 mililitros, 140
Grocery, Boing Boing Jugo sabor Durazno de 500 Ml, Durazno, 500 mililitros, 53
Grocery, Betty Crocker Fudge Brownie Mix, Chocolate, 519 g, 26
Grocery, Boing Boing Jugo sabor Mango de 1 Lt *, Mango, 1000 mililitros, 11
Grocery, Tostitos, Dip Tostitos cebolla francesa 240 g, 240 gramos, 1
Grocery, Dolores Atun Agua 295 gr, 7
Grocery, Isadora Frijol Refrito Bayo Bolsa De 430 Gr, 29
Grocery, PEÑAFIEL, Twist Limón 1 l, Botella Pet, 12 piezas, 37
Grocery, Lala Leche UHT Deslactosada Baja en Grasa con Tapa, 1.5 L, 10 Piezas, 331
Grocery, Sanissimo, Salmas con Maíz Azul, 100 paquetes de 12 gramos cada uno., 14
Grocery, Knorr Sazonador Mi Arroz Blanco 68 gr, 12
Grocery, Unico fresco, Unico fresco jugo de naranja sin pulpa, 1000 mililitros, 9
Grocery, Sanissimo, Salmas con Nopal. 100 paquetes de 12 gramos cada uno, 94
Grocery, Isadora, Frijoles Refritos Bayos Bajos en Grasa, 430 gramos, 55
Grocery, Brandy Torres 10 Años 700 Ml, 16
Grocery, EMPAQUE ESPECIAL - DUO PACK - MEZCAL AMORES ESPADIN + MEZCAL AMORES CUPREATA, 5
Grocery, PEÑAFIEL, Arándano 600 ml, Botella Pet, 12 piezas, 11
Grocery, Verde Valle Arroz Precocido, 300 gramos, 12
Grocery, Rockaleta, Rockaleta Bola 25 Piezas, 400 gramos, 60
Grocery, Jugo de Durazno, Jugo Del Valle, Pack de 6 - 1l/botella, 47
Grocery, Coca-Cola con Café, 8 Pack - 235 ml/lata, 9
Grocery, SNAPPLE, Diet Frambuesa 473 ml, Botella de Vidrio, 12 piezas, 2
Grocery, SNAPPLE, Durazno 473 ml, Botella de Vidrio, 12 piezas, 12
Grocery, Etnia 52, Café de Altura Sabor Avellana, Tueste Medio, Molido, 454 gr, 9
Grocery, Monteblanco Champiñón Rebanado, 186 g, 18
Grocery, La Moderna, Almeja - Pasta para Sopa, 220 gramos, 57
Grocery, Sidral Mundet, Sabor Manzana, 12 Pack - 235 ml/lata, 43
Grocery, Etnia 52, Café de Altura Chiapas, Tueste Americano, Molido, 250 gr, 6
Grocery, Monk Fruit 1Kg, 52
Grocery, Mister Natural Chabacano Deshidratado, 250 g, 11
Grocery, Earth`s Finest Ghee Mantequilla Clarificada - 500g, 3
Grocery, , 310
Grocery, Sanissimo Salmas Tostaditas de Maíz Horneadas con Una Pizca de Sal, 100 paquetes de 12 gramos cada uno, 116
Grocery, Brandy Torres Winter Fruits Botella De 700 ml, 24
Grocery, Brandy Torres 5 Solera Reserva 700 Ml, 12
Grocery, 24 Pack Cerveza en lata Colimita Lager, 2
Grocery, Bonafont, Agua Natural, 1 litro, 6 Pack, 56
Grocery, Verde Valle, Queretaro Frijol Negro, 900 gramos, 114
Grocery, Pronto Leche Condensada, 380 g, 5
Grocery, Cerveza Clara Corona Extra 24 botellas de 355ml c/u, 3
Grocery, Mirinda Narazul, Refresco con Sabor Naranja Arándano, PET Reciclable, 355 Mililitros Cada Una, Paquete de 12, 20
Grocery, McCormick Mayonesa #32, 725 g, 128
Grocery, Verde Valle, Verde Valle Tipo Morelos, 900 gramos, 373
Grocery, Bonafont, Agua Natural, 1.5 litros, 12 Pack, 111
Grocery, Boing Boing Jugo sabor Manzana de 500 Ml *, Manzana, 500 mililitros, 36
Grocery, Ron cubano Pacto Navio 700 ml, 9
Grocery, Mezcal Ojo de Tigre Joven 750 ml, 61
Grocery, MEZCAL AMORES CUPREATA (PAPALOTE) - 750 ML / 40.3°, 2
Grocery, MAIZENA FECULA DE MAIZ ATOLE Sabor Chocolate 3 sobres de 45g c/u, 11
Grocery, MAIZENA FECULA DE MAIZ ATOLE Sabor Fresa 3 sobres de 47g c/u, 27
Grocery, Tequila Don Ramón Plata Punta Diamante 750 ml, 146
Grocery, Cerveza Importada Budweiser, 12 Botellas 1lt c/u, 19
Grocery, Pinalim Tea/Te de Pinalim Versión mexicana - Piña, lino, té verde y té blanco - Suministro de 30 días, 174
Grocery, Heinz Mayonesa con Jugo de limón, 3.5 kg, 4
Grocery, Clavel Clavel Leche Evap Tetra 1 Lt, Dulce, 1 litros, 31
Grocery, Nestlé Agüitas Manzana, 300 mililitros, 11
Grocery, Bola de Oro Café Grano, Descafeinado, 1 kilo, 19
Grocery, Vino Tinto Woodbridge Robert Mondavi Merlot 750 ml, 67
Grocery, Pinalim Tea/Te de Pinalim Mexican Version- Pineapple, Flax, Green Tea, & White Tea - 30 Day Supply by SmileMore, 99
Grocery, Ron Kraken Black Spiced - 750 ml, 9
Grocery, Ron Bacardi Blanco 980 Ml, 10
Grocery, Hellmann's Mayonesa Casera, 170 g, 6
Grocery, Bonafont, Agua Natural, 600ml, 12 Pack, 7
Grocery, Whisky 12 Etiqueta Negra Johnnie Walker - 750 ml, 19
Grocery, Starbucks by Nespresso, Café Blonded Espresso Roasted, contiene 10 cápsulas de Sistema Original, Blonde Espresso, 35
Grocery, Bonafont, Agua Natural, 10 litros, 3
Grocery, Burrito Fiestero 750mL - Mezcal Artesanal 100% agave Cenizo, 42% Alc. Vol, 2
Grocery, Licor Smirnoff Tamarindo De Vodka 750 ml, 5
Grocery, Bonafont, Agua Natural, 6 litros, 2 Pack, 77
Grocery, Cerveza Obscura, Negra Modelo, 12 botellas de 355 ml c/u, 25
Grocery, "Mezcal Alerón Agave Cenizo 750 ml , 67
Grocery, Auténtico Corajillo Dúopack 200ml, 16
Grocery, MEZCAL AMORES LOGIA CENIZO 14 años – 700ML / 46°, 1
Grocery, Knorr, Caldo de Camarón, 8 piezas, 196
Grocery, Nespresso, Café Best Seller, Paquete de 30 cápsulas de Sistema Vertuo (Incluye 10 cápsulas de cada variedad) Tamaño de…, 29
Grocery, Tequila Maestro Dobel Diamante - 750 ml, 9
Grocery, Saké Hattori Hanzo 375 ml, 4
Grocery, Knorr, Knorr Sopa Instantánea de Municiones sobre de 95 Gr, 95 gramos, 4
Grocery, SmileMore - Té Piñalim con piña, linaza, té verde y té blanco - Provisión para 30 días, 52
Grocery, Satoru, Pasta para Preparar Ramen, 170 gramos, 15
Grocery, San Pellegrino Limón Menta Bebida Gasificada con Jugo de Fruta E Infusión de Menta, Limón Menta, 24 piezas, 8
Grocery, OCIXEM, Café en Grano Soconusco, Chiapas, 454 gramos, 46
Grocery, PEÑAFIEL, Fresada 2 l, Botella Pet, 4 piezas, 29
Grocery, Nature's Heart Bebida de Almendra sabor Vainilla Sin Azúcar - 946 ml, 4
Grocery, Nature's Heart Bebida de Avena + Linaza Drink - 946 ml, 30
Grocery, Nescafe Cafe Olla, 170 g, 17
Grocery, Satoru Ponzu, Salsa de Soya con Citricos, Citricos, 275 Mililitros, 9
Grocery, Crackets, Gamesa Galletas Crackets 135 Gr, 135 gramos, 4
Grocery, Bonafont, Agua Natural, 750ml, 6 Pack, Chupón, 14
Grocery, La Sierra Frijoles Bayos Refritos, 440 g, Paquete de 3, 3
Grocery, Absolut Pack Vodka 750 Ml + Vaso + 2 Peñafiel Coco 600 ml, 3
Grocery, 3 minutos, Cereal Mixto, Bote, 1 pieza, 4
Grocery, CERVEZA TROOPER BOX 2 PACK IRON MAIDEN LATA SUN & STEEL-TROOPER ORIGINAL, 13
Grocery, Bonafont, Agua Natural, 2 Litros, 8 Pack, 28
Grocery, Tang, Gauyaba, 8 Sobres de 14 gramos, 14
Grocery, Dolores, Atún preparado con Chipotle, 135 gramos, 1
Grocery, Hellmann's Mayonesa Light 1KG, 12
Grocery, Lala Leche UHT 100 Reducida en Grasa, 1 L, 12 Piezas, 14
Grocery, Epura, Agua Natural sin Sodio en Bidón de PET de 5 Litros, 6
Grocery, NESCAFÉ Dolce Gusto Nescafé Dolce Gusto Au Lait 3 Cubos de 16 cápsulas cada uno, Au Lait, 3 paquetes, 34
Grocery, OCIXEM, Café Molido Soconusco, Chiapas, 454 gramos, 11
Grocery, La Costeña Chile Jalapeño Rajas, 105 g, 5
Grocery, Nespresso, Café Best Seller, Paquete de 50 cápsulas de Sistema Original (Incluye 10 cápsulas de cada variedad), 24
Grocery, Epura Agua sin sodio, Agua Natural, 1.5 litros. Paquete de 12, 14
Grocery, Bragg - Vinagre de Manzana Orgánico 473ml, 5
Grocery, Bragg - Vinagre Organico de Manzana 946ml, 14
Grocery, Dolores, Atún preparado con Chipotle, 135 gramos, 1
Grocery, MEZCAL AMORES LOGIA CENIZO 14 años – 700ML / 46°, 1
Grocery, Tostitos, Dip Tostitos cebolla francesa 240 g, 240 gramos, 1
Grocery, Satoru Vinagre De Arroz Para Preparar Sushi, Agridulce, astringente, 275 mililitros, 1
Grocery, Burrito Fiestero 750mL - Mezcal Artesanal 100% agave Cenizo, 42% Alc. Vol, 2
Grocery, MEZCAL AMORES CUPREATA (PAPALOTE) - 750 ML / 40.3°, 2
Grocery, 24 Pack Cerveza en lata Colimita Lager, 2
Grocery, SNAPPLE, Diet Frambuesa 473 ml, Botella de Vidrio, 12 piezas, 2
Grocery, Morama Harina para Hotcakes, 400 g, 2
Grocery, del Fuerte, del Fuerte Pure Tomate Brick 210 Gr, 210 gramos, 2
Grocery, Absolut Pack Vodka 750 Ml + Vaso + 2 Peñafiel Coco 600 ml, 3
Grocery, La Sierra Frijoles Bayos Refritos, 440 g, Paquete de 3, 3
Grocery, Bonafont, Agua Natural, 10 litros, 3
Grocery, Cerveza Clara Corona Extra 24 botellas de 355ml c/u, 3
Grocery, Earth`s Finest Ghee Mantequilla Clarificada - 500g, 3
Grocery, Principia 12 Pack Mixto (12 botellas de 355 ml), 3
Grocery, 3 minutos, Cereal Mixto, Bote, 1 pieza, 4
Grocery, Crackets, Gamesa Galletas Crackets 135 Gr, 135 gramos, 4
Grocery, Nature's Heart Bebida de Almendra sabor Vainilla Sin Azúcar - 946 ml, 4
Grocery, Knorr, Knorr Sopa Instantánea de Municiones sobre de 95 Gr, 95 gramos, 4
Grocery, Saké Hattori Hanzo 375 ml, 4
Grocery, Heinz Mayonesa con Jugo de limón, 3.5 kg, 4
Grocery, Bob´s Red Mill, Bob´s Red Mill, Polvo para hornear sin gluten, 397g, 397 gramos, 4
Grocery, Coca-Cola Sin Azúcar, 12 Pack - 355 ml/lata, 4
Grocery, Ghee Mantequilla Clarificada 500g, 4
Grocery, Bragg - Vinagre de Manzana Orgánico 473ml, 5
Grocery, La Costeña Chile Jalapeño Rajas, 105 g, 5
Grocery, Licor Smirnoff Tamarindo De Vodka 750 ml, 5
Grocery, Pronto Leche Condensada, 380 g, 5
Grocery, EMPAQUE ESPECIAL - DUO PACK - MEZCAL AMORES ESPADIN + MEZCAL AMORES CUPREATA, 5
Grocery, Epura, Agua Natural sin Sodio en Bidón de PET de 5 Litros, 6
Grocery, Hellmann's Mayonesa Casera, 170 g, 6
Grocery, Etnia 52, Café de Altura Chiapas, Tueste Americano, Molido, 250 gr, 6
Grocery, Cerveza Importada Premium Carlsberg 24 botellas de 330ml c/u, 6
Grocery, Squirt Refresco Jugo, Toronja, 3 litros, 6
Grocery, Sinaloa Chilorio Pouch, 125 g, 6
Grocery, Bonafont, Agua Natural, 600ml, 12 Pack, 7
Grocery, Dolores Atun Agua 295 gr, 7
Grocery, San Pellegrino Limón Menta Bebida Gasificada con Jugo de Fruta E Infusión de Menta, Limón Menta, 24 piezas, 8
Grocery, Satoru Vinagre De Arroz Para Preparar Sushi, Agridulce y Astringente - 275 ml, 8
Grocery, Satoru Ponzu, Salsa de Soya con Citricos, Citricos, 275 Mililitros, 9
Grocery, Tequila Maestro Dobel Diamante - 750 ml, 9
Grocery, Ron Kraken Black Spiced - 750 ml, 9
Grocery, Ron cubano Pacto Navio 700 ml, 9
Grocery, Etnia 52, Café de Altura Sabor Avellana, Tueste Medio, Molido, 454 gr, 9
Grocery, Coca-Cola con Café, 8 Pack - 235 ml/lata, 9
Grocery, Unico fresco, Unico fresco jugo de naranja sin pulpa, 1000 mililitros, 9
Grocery, 12 Pack con 6 cervezas Colimita Lager y 6 cervezas Cayaco Lager Light, 9
Grocery, Ron Bacardi Blanco 980 Ml, 10
Grocery, Satoru Pasta para hacer Sopa Miso, Miso blanco, 200 gramos, 10
Grocery, EMPAQUE ESPECIAL - DUO PACK - MEZCAL AMORES ESPADÍN + MEZCAL AMORES ESPADÍN REPOSADO, 10
Grocery, OCIXEM, Café Molido Soconusco, Chiapas, 454 gramos, 11
Grocery, Nestlé Agüitas Manzana, 300 mililitros, 11
Grocery, MAIZENA FECULA DE MAIZ ATOLE Sabor Chocolate 3 sobres de 45g c/u, 11
Grocery, Mister Natural Chabacano Deshidratado, 250 g, 11
Grocery, PEÑAFIEL, Arándano 600 ml, Botella Pet, 12 piezas, 11
Grocery, Boing Boing Jugo sabor Mango de 1 Lt *, Mango, 1000 mililitros, 11
Grocery, Hellmann's Mayonesa Light 1KG, 12
Grocery, Brandy Torres 5 Solera Reserva 700 Ml, 12
Grocery, SNAPPLE, Durazno 473 ml, Botella de Vidrio, 12 piezas, 12
Grocery, Verde Valle Arroz Precocido, 300 gramos, 12
Grocery, Knorr Sazonador Mi Arroz Blanco 68 gr, 12
Grocery, Cerveza Clara, Modelo Especial, 12 botellas de 355 ml c/u, 12
Grocery, Esquites Listos Para Disfrutar (Tradicional (Epazote con Chile de arbol), 4 Bolsas por Caja), 12
Grocery, CERVEZA TROOPER BOX 2 PACK IRON MAIDEN LATA SUN & STEEL-TROOPER ORIGINAL, 13
Grocery, Cerveza Ámbar Victoria 24 latas de 355 ml c/u, 13
Grocery, Cerveza belga Gulden Draak 8 pack mixto, 13
Grocery, Cerveza Artesanal Lagunitas Ipa/prohibida Venta A Menor, 13
Grocery, Bragg - Vinagre Organico de Manzana 946ml, 14
Grocery, Epura Agua sin sodio, Agua Natural, 1.5 litros. Paquete de 12, 14
Grocery, Lala Leche UHT 100 Reducida en Grasa, 1 L, 12 Piezas, 14
Grocery, Tang, Gauyaba, 8 Sobres de 14 gramos, 14
Grocery, Bonafont, Agua Natural, 750ml, 6 Pack, Chupón, 14
Grocery, Sanissimo, Salmas con Maíz Azul, 100 paquetes de 12 gramos cada uno., 14
Grocery, Satoru, Pasta para Preparar Ramen, 170 gramos, 15
Grocery, Auténtico Corajillo Dúopack 200ml, 16
Grocery, Brandy Torres 10 Años 700 Ml, 16
Grocery, Mix de Nueces con Fruta Tropical, 907 gr, 16
Grocery, Nescafe Cafe Olla, 170 g, 17
Grocery, Carnation, Evaporada, 720 gramos, 17
Grocery, Monteblanco Champiñón Rebanado, 186 g, 18
Grocery, Tuny, Ensalada de Atún con Mayonesa, 135 g, 135 gramos, 18
Grocery, Betty Crocker Super Moist German Chocolate Cake Mix, 432 gramos, 18
Grocery, Whisky 12 Etiqueta Negra Johnnie Walker - 750 ml, 19
Grocery, Bola de Oro Café Grano, Descafeinado, 1 kilo, 19
Grocery, Cerveza Importada Budweiser, 12 Botellas 1lt c/u, 19
Grocery, La Moderna, Macarrón, Pasta, 220 Gramos, 19
Grocery, Mirinda Narazul, Refresco con Sabor Naranja Arándano, PET Reciclable, 355 Mililitros Cada Una, Paquete de 12, 20
Grocery, Lagunitas Pils 4x6 Bot 355ml, 20
Grocery, Heinz Mayonesa Chipotle, 390 g, 20
Grocery, Wellhouse Nuez de Castilla (Walnut), Nuez, 850 gramos, 21
Grocery, Cerveza Preparada Sol Clamato 24 Pack Lata 473 Ml, 22
Grocery, Ron Solera 23 Años Zacapa Gran Reserva 750 Ml, 23
Grocery, Nespresso, Café Best Seller, Paquete de 50 cápsulas de Sistema Original (Incluye 10 cápsulas de cada variedad), 24
Grocery, Brandy Torres Winter Fruits Botella De 700 ml, 24
Grocery, Cerveza Artesanal Cajota Feliz Minerva, 24
Grocery, Sidra De Manzana Strongbow Honey 12 Pack Botella 330 Ml, 24
Grocery, Sidra Strongbow Rosé 12 Pack Botella 330 Ml, 24
Grocery, Sidra Strongbow Red Berries 12 Pack Botella 330 Ml, 24
Grocery, Cerveza Premium Bohemia Weizen 24 Pack Botella 355 Ml, 24
Grocery, Cerveza Obscura, Negra Modelo, 12 botellas de 355 ml c/u, 25
Grocery, Vodka New Amsterdam Coconut 750ml, 25
Grocery, Betty Crocker Fudge Brownie Mix, Chocolate, 519 g, 26
Grocery, MAIZENA FECULA DE MAIZ ATOLE Sabor Fresa 3 sobres de 47g c/u, 27
Grocery, Sabritas, Chicharrón de Cerdo Sabritas 115 g, 115 gramos, 27
Grocery, Bonafont, Agua Natural, 2 Litros, 8 Pack, 28
Grocery, PEÑAFIEL, Fresada 2 l, Botella Pet, 4 piezas, 29
Grocery, Nespresso, Café Best Seller, Paquete de 30 cápsulas de Sistema Vertuo (Incluye 10 cápsulas de cada variedad) Tamaño de…, 29
Grocery, Isadora Frijol Refrito Bayo Bolsa De 430 Gr, 29
Grocery, Nature's Heart Bebida de Avena + Linaza Drink - 946 ml, 30
Grocery, Agua Mineral sabor Naranja, San Pellegrino, Aranciata Italiana, 330 ml, Paquete de 12, 30
Grocery, Clavel Clavel Leche Evap Tetra 1 Lt, Dulce, 1 litros, 31
Grocery, Whisky Buchanan'S 12 Años 750Ml, 31
Grocery, Cerveza Clara Dos Equis Lager 24 Pack Botella 355 Ml, 31
Grocery, NESCAFÉ Dolce Gusto Nescafé Dolce Gusto Au Lait 3 Cubos de 16 cápsulas cada uno, Au Lait, 3 paquetes, 34
Grocery, Cerveza Clara Corona Extra 24 latas de 355ml c/u, 34
Grocery, Cerveza Clara Corona Light 24 botellas de 355ml c/u, 34
Grocery, Starbucks by Nespresso, Café Blonded Espresso Roasted, contiene 10 cápsulas de Sistema Original, Blonde Espresso, 35
Grocery, Boing Boing Jugo sabor Manzana de 500 Ml *, Manzana, 500 mililitros, 36
Grocery, PEÑAFIEL, Twist Limón 1 l, Botella Pet, 12 piezas, 37
Grocery, Licor de Hierbas para Carajillo Sisi 1L, 38
Grocery, Cerveza Oscura, Negra Modelo, 24 Latas de 355ml c/u, 39
Grocery, Sidral Mundet, Sabor Manzana, 12 Pack - 235 ml/lata, 43
Grocery, Cerveza Modelo Combo Premium Pack, 12 Botellas de 355ml c/u, 44
Grocery, Cerveza Premium Bohemia Pilsner, 44
Grocery, Cerveza Clara Corona Light lata de 2 12 pack de 355ml c/u total 24 latas, 44
Grocery, Cerveza Premium Bohemia Vienna, 44
Grocery, OCIXEM, Café en Grano Soconusco, Chiapas, 454 gramos, 46
Grocery, Isadora Frijoles Claros Enteros, 454 gramos, 46
Grocery, Jugo de Durazno, Jugo Del Valle, Pack de 6 - 1l/botella, 47
Grocery, Berry Nuts 30 bolsitas de snacks TO GO, un poco de cada uno de nuestros 7 sabores., 49
Grocery, Sabrosano Aceite De 850 ml, 51
Grocery, SmileMore - Té Piñalim con piña, linaza, té verde y té blanco - Provisión para 30 días, 52
Grocery, Monk Fruit 1Kg, 52
Grocery, Morama Harina de Almendra, 350 g (el empaque puede variar), 52
Grocery, Boing Boing Jugo sabor Durazno de 500 Ml, Durazno, 500 mililitros, 53
Grocery, Isadora, Frijoles Refritos Bayos Bajos en Grasa, 430 gramos, 55
Grocery, Agua Mineral, Agua Ciel, 12 Pack - 355 ml/lata, 55
Grocery, Schweppes, Ginger Ale 1 L, Botella Pet, 12 Piezas, 55
Grocery, Bonafont, Agua Natural, 1 litro, 6 Pack, 56
Grocery, La Moderna, Almeja - Pasta para Sopa, 220 gramos, 57
Grocery, Knorr, Caldo de Costilla granulado, 200 gramos, 58
Grocery, Herdez Granos de Elote, 400 gr, 58
Grocery, Rockaleta, Rockaleta Bola 25 Piezas, 400 gramos, 60
Grocery, Mezcal Ojo de Tigre Joven 750 ml, 61
Grocery, Victoria 1.8 24 latas de 473ml c/u, 61
Grocery, Cerveza Premium Heineken 24 Pack Botella 355 Ml, 64
Grocery, "Mezcal Alerón Agave Cenizo 750 ml , 67
Grocery, Vino Tinto Woodbridge Robert Mondavi Merlot 750 ml, 67
