Hpc, E T EASYTAO 4 en 1 Oxímetro de Pulso de Dedo con Pantalla OLED, Monitor Digital de Frecuencia de Respiración RR, Frecuencia Cardíaca PR, Saturación de Oxígeno en Sangre SpO2 e Indice de Perfusión PI, 305
Hpc, Neutrogena Hydro Boost - Hyaluronic Acid - Gel a base de Água para Piel Seca, 48g (1.7 fl. oz), 311
Hpc, Vitamina D3 OneDrop frasco 3ml, 312
Hpc, Kleenex Cottonelle Soft, Papel Higiénico, 32 Rollos, 1 count, 315
Hpc, L'Oreal Paris Mascarilla Facial Anti-Imperfecciones Arcillas Puras, 48 ml, 325
Hpc, Oxímetro ANU Monitor de Saturación de Oxígeno SpO2 & Ritmo Cardíaco BPM con Pantalla OLED, 326
Hpc, Termómetro de No Contacto para Bebés, con Alarmas de Alta Temperatura- Sonolife, 328
Hpc, "LIFEED5 HAIR NAILS , 330
Hpc, Kleenex Mascarillas, Cubrebocas Ajustable, Caja con 10 piezas de Triple Capa Protectora, 358
Hpc, Etekcity, báscula de peso digital con Bluetooth, Apple Health y Google Fit, 400 libras, aprobado por la FDA, 359
Hpc, Vichy Minéral 89 Daily Skin Booster Serum and Moisturizer, 1.01 Fl. Oz, 394
Hpc, Maybelline Base de Maquillaje Fit Me Matte, 102 Fair Porcelain, 398
Hpc, Serum Ácido Hialurónico Facial+Vitamina B5+Extracto de Bulbo de Azafrán-99% Ingredientes Naturales-Hidratación Intensa…, 403
Hpc, Philips MG3750/60 Rasuradora Recargable (Negro, Metálico, 60 min, Integrado, AC/batería, 1 h, Ión de litio), 405
Hpc, Lysol Toallitas Antibacteriales para Manos, 409
Hpc, Serum Vitamina C + Ácido Hialurónico + Vitamina E- Serum Facial -95% Ingredientes Naturales- Aclara, Revitaliza…, 410
Hpc, E T EASYTAO 4 en 1 Oxímetro de Pulso de Dedo con Pantalla OLED, Monitor Digital de Frecuencia de Respiración RR…, 410
Hpc, Oxímetro de Dedo, Monitor de Saturación de Oxígeno en Sangre con Frecuencia de Pulso, Índice de Perfusión, Medición…, 410
Hpc, Suavitel Cuidado Superior Fresca Primavera - Suavizante de Ropa, 3 l, empaque puede variar, 411
Hpc, Labello Labello Barbie Cereza Edición Limitada, Color, 4.8 Gram, Pack Of/Paquete De, 423
Hpc, , 428
Hpc, Lysol Gel Antibacterial para Manos, 50ml, 496
Hpc, Pétalo Servilletas, color, 350 Piezas, 350.0 count, 500
Hpc, Cyxus Filtro de Luz Azul Gafas de Computadora Anti Fatiga de Ojos Lentes Transparentes para Hombres y Mujeres Bloqueo UV, 523
Hpc, Escudo Gel Antibacterial, 70 ml, 538
Hpc, Suavel Servilletas, 380 Piezas, 577
Hpc, MAS Detergente Líquido para Ropa Oscura, 1.83 litros, 590
Hpc, Maybelline Corrector de Maquillaje Instant Age Rewind, Golden, 6 ml, 603
Hpc, DOVE 6PACK JABÓN BARRA BLANCA 100G CADA UNA, 638
Hpc, Axion Detergente Lavatrastes Liquido Limon, 900 ml, 1 Unidad, 658
Hpc, Arctic Fox Vegan Phantom Green Semi Permanent Hair Color Dye 4 Fl. Oz, 690
Hpc, Colgate Pasta Dental Total Clean Mint Multibeneficios, 100 ml, 2 Piezas, 694
Hpc, Regio Aires de Frescura Papel Higiénico, 200 hojas dobles, 32 Rollos, 700
Hpc, Escudo Gel Antibacterial 275ml, 711
Hpc, Termometro infrarrojo de Grado Medico Berrcom JXB-178, 711
Hpc, Maybelline Labial Liquido Matte Larga Duracion Superstay City Edition, 105 Explorer, 712
Hpc, Pétalo Servitoalla Decorada, 3 Rollos con 60 hojas dobles cada uno., 714
Hpc, Papel Higiénico, Regio Luxury Almond Touch, Hojas Dobles, 18 Rollos, 714
Hpc, Kleenex Servitoalla Duramax, 715
Hpc, REVLON Salon One-Step Secador y Voluminizador, Menta, 715
Hpc, Crema hidratante anti-líneas de expresion Revitalift Ácido Hialurónico Día de L'Oréal Paris, 50 ml, 715
Hpc, Escudo Jabón Líquido Refill para Manos, 450 ml, 715
Hpc, Pétalo Rendimax Papel Higiénico con Aloe y Vitamina E, color Blanco, 12 Rollos de 320 Hojas, 715
Hpc, Termómetro Digital Infrarrojo Sin Contacto con Medición Corporal y de Superficies/Objetos - Sonolife, 715
Hpc, Escudo Antibacterial Toallitas Húmedas, 1 Paquete con 50 Toallitas, Protección y Limpieza para tu Piel, 715
Hpc, Oxímetro Digital de Pulso con Pletismografía, 715
