Hpc, Maybelline Labial Liquido Matte Larga Duracion Superstay City Edition, 105 Explorer, 712
Hpc, Oxímetro Digital de Pulso con Pletismografía, 715
Hpc, E T EASYTAO 4 en 1 Oxímetro de Pulso de Dedo con Pantalla OLED, Monitor Digital de Frecuencia de Respiración RR, Frecuencia Cardíaca PR, Saturación de Oxígeno en Sangre SpO2 e Indice de Perfusión PI, 305
Hpc, Termometro infrarrojo de Grado Medico Berrcom JXB-178, 711
Hpc, Serum Vitamina C + Ácido Hialurónico + Vitamina E- Serum Facial -95% Ingredientes Naturales- Aclara, Revitaliza, Restablece, Hidrata y Tonifica la Piel-Ideal Para Todo Tipo de Piel-30ml, 305
Hpc, Escudo Antibacterial Toallitas Húmedas, 1 Paquete con 50 Toallitas, Protección y Limpieza para tu Piel, 715
Hpc, Termómetro Digital Infrarrojo Sin Contacto con Medición Corporal y de Superficies/Objetos - Sonolife, 715
Hpc, Regio Aires de Frescura Papel Higiénico, 200 hojas dobles, 32 Rollos, 700
Hpc, L'Oreal Paris Labial Liquido Mate Infallible Chocolates, Candy Man 842, 8 ml, 41
Hpc, Pétalo Rendimax Papel Higiénico con Aloe y Vitamina E, color Blanco, 12 Rollos de 320 Hojas, 715
Hpc, Bellati 5 Piezas Cubrebocas 3 Capas Doble Tela con Filtro intermedio Lavable Mascarilla tapabocas Reutilizable Color Negro, 156
Hpc, Oxímetro ANU Monitor de Saturación de Oxígeno SpO2 & Ritmo Cardíaco BPM con Pantalla OLED, 326
Hpc, Escudo Jabón Líquido Refill para Manos, 450 ml, 715
Hpc, Axion Detergente Lavatrastes Liquido Limon, 900 ml, 1 Unidad, 658
Hpc, Crema hidratante anti-líneas de expresion Revitalift Ácido Hialurónico Día de L'Oréal Paris, 50 ml, 715
Hpc, Papel Higiénico, Regio Luxury Almond Touch, Hojas Dobles, 18 Rollos, 714
Hpc, Etekcity, báscula de peso digital con Bluetooth, Apple Health y Google Fit, 400 libras, aprobado por la FDA, 359
Hpc, Oxímetro de Dedo, Monitor de Saturación de Oxígeno en Sangre con Frecuencia de Pulso, Índice de Perfusión, Medición Infrarroja, 305
Hpc, Escudo Gel Antibacterial 275ml, 711
Hpc, REVLON Salon One-Step Secador y Voluminizador, Menta, 715
Hpc, Suavel Servilletas, 380 Piezas, 577
Hpc, Labello Labello Barbie Cereza Edición Limitada, Color, 4.8 Gram, Pack Of/Paquete De, 423
Hpc, Arctic Fox Vegan Phantom Green Semi Permanent Hair Color Dye 4 Fl. Oz, 690
Hpc, Termómetro Infrarrojo de No Contacto para Control de Accesos y Personal, 109
Hpc, Pétalo Servitoalla Decorada, 3 Rollos con 60 hojas dobles cada uno., 714
Hpc, Maybelline Labial liquido matte larga duracion superstay matte pink edition maybelline, pink mover, 43
Hpc, L'Oreal Paris Labial liquido mate, infallible les macarons l'oreal paris, tono 818 dose of rose, 37
Hpc, Labello Labello Barbie Mora Edición Limitada, Color, 4.8 Gram, Pack Of/Paquete De, 27
Hpc, Suavitel Cuidado Superior Fresca Primavera - Suavizante de Ropa, 3 l, empaque puede variar, 411
Hpc, Labello Labello Barbie Fresa Edición Limitada, Color, 4.8 Gram, Pack Of/Paquete De, 27
Hpc, Maybelline Corrector de maquillaje instant age rewind maybelline light honey Light Honey, 27
Hpc, Vitamina D3 5000 UI de 300 softgels B Life, 263
Hpc, Kleenex Servitoalla Duramax, 715
Hpc, Philips MG3750/60 Rasuradora Recargable (Negro, Metálico, 60 min, Integrado, AC/batería, 1 h, Ión de litio), 405
Hpc, Sonolife Báscula Digital con Analizador de Grasa Corporal, 14
Hpc, Aderogyl Ampolletas Oral, 3 ml, 5 Piezas, 132
Hpc, Regio Papel Higiénico Luxury Almond Touch; Ligero Aroma A Almendras Y Hojas Dobles; Marca Regio 32 Rollos, color, 32 count, pack of/paquete de, 160
Hpc, Saba Buenas Noches con Alas; Toallas Femeninas Nocturnas XL, Flujo Súper Abundante; 28 Toallas, 32
Hpc, Escudo Gel Antibacterial, 70 ml, 538
Hpc, Andego Corrector de Postura Hombre Mujer - Cómodo y Eficaz Faja para Postura de Espalda Hombre para Combatir el Encorvamiento - Mejorar Postura, 72
Hpc, Termómetro de No Contacto para Bebés, con Alarmas de Alta Temperatura- Sonolife, 328
Hpc, Maybelline Color Sensational Inti-Matte Nudes Lipstick, Beige Babe, 0.15 Oz, 1
Hpc, Amazon Essentials Chamarra Deportivo Tela Abrigo de Vestir para Hombre, 14
Hpc, Neutrogena Hydro Boost - Hyaluronic Acid - Gel a base de Água para Piel Seca, 48g (1.7 fl. oz), 311
Hpc, Colgate Pasta Dental Total Clean Mint Multibeneficios, 100 ml, 2 Piezas, 694
Hpc, Labial mate, Soft Matte Lip Cream, Nyx Professional Makeup ,Tono Abu Dhabi ,8ml, 1
Hpc, Oxímetro de Pulso LUBL Monitor de Saturación de Oxígeno SpO2 y Pulso Cardíaco con Pantalla OLED, 8
Hpc, Paquete de 8 cubrebocas de NIÑOS. Lavables/reutilizables de triple capa de suave tela de algodón/poliester Repelente al agua. AJUSTABLE Combo de Colores Azul Claro Y Gris, 33
Hpc, Philips Norelco Multi Groomer MG5750/49 - 18 piece, beard, body, face, nose, and ear hair trimmer and clipper, 167
Hpc, Maybelline Pomada para Cejas Brow Tattoo, Dark Brown, 3.7 g, 28
Hpc, Persil Detergente Alta Higiene, 3L, 234
Hpc, L'Oréal Paris Riche Free The Nudes Labial en Barra Ultra Mate Color, 01 No Obstacles,, 12
Hpc, Maybelline Corrector de Maquillaje Instant Age Rewind, Golden, 6 ml, 603
Hpc, Revlon 1875W Secadora de Mango Plegable y Cable Retráctil, 53
Hpc, Kleenbebé Suavelastic Toallitas Húmedas, Aroma Coco, 600 Toallitas, Pack of 1, 28
Hpc, , 428
Hpc, Suavitel Suavizante de Ropa Cuidado Superior, Anochecer, 850 ml, 99
Hpc, 3M Scotch-Brite Fibra Esponja Aroma Limón, Tamaño Chico, 6
Hpc, Maybelline Labial liquido matte larga duracion superstay matte pink edition maybelline, pink pathfinder, 1
Hpc, Regio Rinde Más Papel Higiénico, 12 Rollos, 26
Hpc, Saba Intima Clip; Toalla Femeninas para Flujo Abundante, Centro de Rápida Absorción; 42 Toallas, 56
Hpc, ZEST Jabón de tocador vitalidad pepino 5 pack de 100 g cada barra, 68
Hpc, Coate Pasta Dental Coate Luminous blanco 2 Piezas con U, color, 75 ml, pack of aquete de 2, 90
Hpc, Papel Higiénico Just 1; Con Hojas Cuádruples 50% Mas Gruesas, Centro Suave; Marca Regio; 12 Rollos, 270
Hpc, dospuntos Usable en Interiores y Exteriores (6p Negro), 16
Hpc, "LIFEED5 INMUNE , 232
Hpc, DOVE 6PACK JABÓN BARRA BLANCA 100G CADA UNA, 638
Hpc, Lubriderm Crema Reparación Intensiva, 240ml, 20
Hpc, Thayers Alcohol-Free Lavender Witch Hazel Toner with Aloe Vera, 12 ounce bottle, 190
Hpc, Suavitel - Suavizante de Ropa, Cuidado Superior, Fresco Aroma de Sol, 850 ml, 19
Hpc, Suavitel Suavizante de ropa suavitel cuidado superior bebé antibacterial 850 ml, 63
Hpc, BIENAT AROMATERAPIA Aceite Esencial de Ylang Ylang 10mL, 145
Hpc, Maybelline Base de Maquillaje Fit Me Matte, 102 Fair Porcelain, 398
Hpc, Vitamina C más Jengibre de 240 Cápsulas Marca B Life, 3
Hpc, Optimum Nutrition - Gold Standard - Proteina de Suero, Chocolate Blanco 5Lb/2.26Kg, 30
Hpc, "LIFEED5 HAIR NAILS , 330
Hpc, Cubrebocas Termosellado 3 capas por Joyas Derby 100pz, 32
Hpc, "ZEN•ZEI , 12
Hpc, Sico  Piel con Piel - Condones Sin Látex Color natural, cartera con 9 piezas, 17
Hpc, Vitamina D3 OneDrop frasco 3ml, 312
Hpc, Isdin Fusion Water Color Fotoprotector, 50 ml, Paquete de 1, 10
Hpc, Viva Poder Dual con CLOROX Ropa Universal 6.64 L, 6.64 lts, 121
Hpc, L'Oreal Paris Mascarilla Negra, Arcillas Puras, 40 ml, 177
Hpc, Paquete de 8 cubrebocas de NIÑ@S. Lavables/reutilizables de triple capa de suave tela de algodón/poliester Repelente al agua. AJUSTABLE Gris Oxford, 8
Hpc, Cyxus Filtro de Luz Azul Gafas de Computadora Anti Fatiga de Ojos Lentes Transparentes para Hombres y Mujeres Bloqueo UV, 523
Hpc, Palmolive Palmolive Neutro Balance Jabón en Barra para Hombre, 150 Gramos, Pack de 4, color, 4 count, pack of aquete de, 208
Hpc, Pétalo Servilletas, color, 350 Piezas, 350.0 count, 500
Hpc, Paquete de 8 cubrebocas de NIÑOS. Lavables/reutilizables de triple capa de suave tela de algodón/poliester Repelente al agua. AJUSTABLE Combo de Colores Azul Marino Y Gris, 2
Hpc, Cuba Gold by Cuba, 3.30 Ounce, 7
Hpc, Lysol Gel Antibacterial para Manos, 50ml, 496
Hpc, Nautica Voyage Eau de Toilette para Hombre, Multicolor, 100 ml, 17
Hpc, Eucerin Protector Solar Oil Control, 50 ml, 3
Hpc, Gel Facial Hidratante con Ácido Hialurónico + Niacinamida + Alga Wakame - 97% Ingredientes Naturales - Hidratación Extrema- Suavidad- Aumenta la Luminosidad Natural de tu Piel- Oil-Free- Ideal Para Todo Tipo de Piel- Hidratante facial de rápida absorción- 50ml, 2
Hpc, SEDAL Crema para peinar rizos definidos 300 ml, 8
Hpc, Colgate Luminous White Advanced Expert Crema dental anticares con flúor, 70g, 8
Hpc, Amazon Brand - Pantalones Chinos de Sarga elástica con Botones para Hombre de Ajuste Recto de 5 Bolsillos, fácil Cuidado, 46
Hpc, Eufy by Anker C1 Báscula inteligente, bluetooth, 13 Indicadores Físicos, pantalla LED, Conexión Apple Health, Google Fit y Fitbit, encendido/apagado automático., 54
Hpc, Colgate - Gel Dental Kids, Uvaventura/Fresantastico, 50 g (Modelos surtidos), 4
Hpc, Corrector de Postura - Pesoo Corrección de la Postura de Espalda para Mujeres, Hombres y Adolescentes Alivio del Dolor de Hombros, Cuello Ajustable y Cómodo Dispositivo de Soporte para Clavícula de la Parte Superior de la Espalda, 32
Hpc, Playboy Condoms Vitrolero con 100 Condones Clasicos, 2
Hpc, Bellati 5 Piezas Cubrebocas con Filtro Lavable Mascarilla tapabocas Reutilizable Color Negro, 11
Hpc, Rhino BABAIN-180 BL Bascula digital con bluetooth para el análisis de grasa corporal, 9 datos analizados, 24 usuarios y modo pesaje de bebés., 39
Hpc, Maybelline Corrector de Maquillaje Instant Age Rewind, Neutralizer, 6 ml, 133
Hpc, Desodorante Stefano Minight Aerosol 159ml, 13
Hpc, Lady Speed Stick Antitranspirante Derma y Perla en Aerosol para Dama, 150 ml, 7
Hpc, Sendowtek Removedor de la Espinilla, Limpiador de Poros 6 en 1, 6 Sondas y 3 Niveles de Succión Ajustable, Pantalla LED, USB Carga Portátil para Viaje, 29
Hpc, Amazon Essentials Pantalón elástico Ligero Pantalones para Hombre, 12
Hpc, Men Speed Stick Desodorante Cool Freedom en Aerosol para Caballero, 140 ml, 3
Hpc, Palmolive Desodorante Antitranspirante Palmolive Neutro Balance en Roll On para Dama 65 ml, color, 65 ml, pack of aquete de, 10
Hpc, Regio Papel Higiénico Regio Suave Deleite 12S, Color, 12 Count, Pack Of aquete de, 76
Hpc, Serum Ácido Hialurónico Facial+Vitamina B5+Extracto de Bulbo de Azafrán-99% Ingredientes Naturales-Hidratación Intensa-Reafirma y Tonifica tu Piel-Revitaliza Tu Cara-Disminuye arrugas y lineas de expresión-Estimula producción de colágeno y elastina - Ideal para todo tipo de piel-30ml, 218
Hpc, Manicura Set - 18 en 1 Manicura y Pedicura Profesional Herramientas de Cortauñas Manicura Uñas Clipper Kit de Viaje Ear Pick Set Ceja y Nariz Recortador de Pelo Preparación Kit de Tijeras de Uñas Belleza Cuidado de Uñas Cortadores con Cuero Negro Caso, 4
Hpc, Difusor de Aceites Esenciales - Pesoo 300ml Difusor Aromaterapia Difusores de Aromas Humidificador Aromaterapia Purificador de Ambiente Ultrasónico Luces Ajustables de 7 Colores con 6 Botellas de Aceite Esencial, 5
Hpc, Vick V900-CSP Termometro Digital, 30 Segundos, 13
Hpc, Maybelline Vao F.Strong, 1
Hpc, Lubriderm Men's 3-In-1 Fragrance-Free Lotion, 16 fl. oz, 15
Hpc, Cool Water By Davidoff For Men. Spray 4.2 Ounces, 9
Hpc, L'Oreal Paris Crema para Hombre, Men Expert, 50 ml, 114
Hpc, L'Oreal Paris Roll On Crema para Ojos, Men Expert, 10 ml, 15
Hpc, Garnier Skin Naturals Face Agua Micelar Desmaquillante para Todo Tipo de Piel, 400 ml, 113
Hpc, ST IVES Crema corporal Colágeno y Elastina piel renovada 532 ml, 7
Hpc, Regio Advanced Toallas de Papel, 88 hojas, 2 Rollos, 85
Hpc, Gillette Venus Sensitive Máquinas Para Afeitar Desechables 2 Unidades, 22
Hpc, Playboy Condoms 36 Condones MaxSens Passion Mix en 9 Paquetes con 4 Condones c\u, 10
Hpc, Tío Nacho Shampoo Herbolaria Mexicana 415 ml, 10
Hpc, MAS Detergente Líquido para Ropa Oscura, 1.83 litros, 590
Hpc, Gillette Mach3 Sensitive Cartucho de repuesto para afeitadora para hombres, 2 Unidades, 21
Hpc, REXONA EFFICIENT Talco antibacterial en aerosol 200 g, 2
Hpc, REXONA MEN desodorante antitranspirante Active Dry en aerosol 90 g para hombre, 10
Hpc, Oxímetro y Pulsómetro para Monitoreo de Saturación de Oxígeno y Latidos por Minuto con Pletismografía Saturación de Oxígeno, 121
Hpc, Escala de Grasa Corporal, TYC Báscula Inteligente Bluetooth 4.0 Digital Analizador de Composición Corporal, 400 libras, 70 datos Relacionados alta precisión Compatible con Android y IOS, 132
Hpc, Amazon Essentials Pantalón Corto elástico de Ajuste Regular. Pantalones Cortos para Hombre, 18
Hpc, L'Oreal Paris Crema Antiarrugas Hombre, Men Expert, 50 ml, 27
Hpc, Jabón de Tocador Palmolive Naturals Lavanda y Crema en Barra, 150 g, 4 Piezas, 22
Hpc, Garnier Skin Naturals Face Garnier skin active express aclara crema hidratante tono uniforme con fps 30, 12
Hpc, L'Oreal Paris Crema Antiarrugas Hidra Total5, 50 ml, 186
Hpc, Oximetro de Pulso Monitor de Oxigenación Sanguínea SpO2 Gráfico Colores, 8
Hpc, "CeraVe Crema Reparadora para el Contorno de Ojos , 85
Hpc, AXIOMA Xl lashes by axioma serum amplificador para pestanas, 3
Hpc, Colgate Coate Coate Enjuague Bucal Coate Plax Ice Glacial 1000 ml, color, 1000 ml, pack of aquete de, 7
Hpc, Garnier Skin Naturals Face Mascarilla facial en tela para piel grasa con carbon hidrabomb garnier, 1pza Carbon, 196
Hpc, "CeraVe Crema Hidratante , 13
Hpc, "CeraVe Gel Limpiador Espumoso , 77
Hpc, Suavel Papel Higiénico, Multicolor, 12 Rollos de 200 Hojas, 290
Hpc, Just Home Bascula Corporal Digital Personal de Baño Cristal Templado Práctica Liviana Diagnostica Balanza Mide Peso para Baño Pantalla LCD Interior, 58
Hpc, Arm & Hammer Desodorante Ultra Max Active Sport, 73 gr, 3
Hpc, Neutrogena Deep Clean Exfoliante Facial, 124ml, 2
Hpc, Vichy Minéral 89 Daily Skin Booster Serum and Moisturizer, 1.01 Fl. Oz, 394
Hpc, "CeraVe Loción Hidratante , 125
Hpc, Downy Perfume collections romance suavizante de telas, 750 ml (el empaque puede variar), 9
Hpc, Kleenex Cottonelle Soft, Papel Higiénico, 32 Rollos, 1 count, 315
Hpc, Nano Difusor Atomizador Sanitizante portátil Humidificador Desinfectante Alcohol Spray USB Recargable para Limpiar Superficies o Humectar la Piel, 112
Hpc, Palmolive Aquarium Series Jabón líquido para manos, 221 ml, 24
Hpc, Listerine Enjuague Bucal Cuidado Total, 500ml, 28
Hpc, Garnier Skin Naturals Face Express aclara crema hidratante tono uniforme con fps 30, 73
Hpc, Vichy Minéral 89 - Ácido Hialurónico en suero diario para rostro que fortalece e hidrata la piel para una apariencia sana de la piel, apto para piel sensible, 14
Hpc, ZEST Jabón en Barra Agua de Coco, 5pack de 100 g cada barra, 10
Hpc, Pasta Lassar Andrómaca Tubo, 60 g, 11
Hpc, Termómetro Digital Infrarrojo de No Contacto con Medición Frontal y de Objetos, 40
Hpc, L'Oreal Paris Crema Hidratante Hidra Total 5, 50 ml, 45
Hpc, L'Oreal Paris Mascarilla Exfoliante, Arcillas Puras, 40 ml, 27
Hpc, ZEST Jabón Neutro Antibacterial, 5pack de 100 g cada barra, 11
Hpc, Goodthreads Blazer de Lana de Ajuste estándar. Americana para Hombre, 40
Hpc, Gillette Mach3 Cartuchos Para Afeitar 2 Unidades, 7
Hpc, Ashwagandha 180 Capsulas (2 Frascos de 90) SuperVida Nutrition, 6
Hpc, Kleenex Mascarillas, Cubrebocas Desechable, Caja Con 10 Piezas Ajustables de Triple Capa Protectora, 31
Hpc, "Forzagen Essentials Men's Multivitamin - 60 Tabletas , 9
Hpc, Skechers Go Walk Skechweave Suave Cintura Movimiento II Corto Pantalones Cortos para Hombre, 5
Hpc, HILBALM （Paquete 3）Gafas de Filtro de Luz Azul Lentes Antireflejantes Mujer y Hombres Gafa de Computadora para [Anti Tensión de Ojos] (Negro, leopardo, rosa/paquete 3), 25
Hpc, Oxímetro y Pulsómetro para Monitoreo de Saturación de Oxígeno Latidos por Minuto con Pletismografía Saturación de Oxígeno Dos Opciones de Colores, 12
Hpc, 3M Command Gancho Sujetaescobas, Blanco (Modelo 17007ES), 8
Hpc, MAYBELLINE Labial liquido de larga duracion y no se transifere con acabado matte superstay matte ink coffee edition, caramel collector con aroma a café, Caramel Collector, 11
Hpc, Nivea Men Antitranspirante Deep Spray, 150 ml, 31
Hpc, Kleenex Mascarillas, Cubrebocas Ajustable, Caja con 10 piezas de Triple Capa Protectora, 358
Hpc, Maybelline Labial liquido de larga duracion y no se transifere con acabado matte superstay matte ink coffee edition, chai genius con aroma a cafe. Chai Genius, 8
Hpc, L'Oreal Paris Mascara para pestanas lash paradise l'oreal paris Negro, 98
Hpc, Lysol Toallitas Antibacteriales para Manos, 409
Hpc, Oxímetro de Pulso de Dedo, Certificado y aprobado por la FDA (Administración de Drogas y Alimentos de Los Estados Unidos), Monitor Digital de Frecuencia Cardíaca PR (Azul)., 2
Hpc, REXONA desodorante CLINICAL antitranspirante en crema para dama 48 g, 83
Hpc, MAYBELLINE Labial liquido de larga duracion y no se transifere con acabado matte superstay matte ink coffee edition, espresso enthusiast con aroma a café, 9
Hpc, Oxímetro de Dedo, Monitor de Saturación de Oxígeno en Sangre con Frecuencia de Pulso, Índice de Perfusión, Medición…, 410
Hpc, E T EASYTAO 4 en 1 Oxímetro de Pulso de Dedo con Pantalla OLED, Monitor Digital de Frecuencia de Respiración RR…, 410
Hpc, Serum Vitamina C + Ácido Hialurónico + Vitamina E- Serum Facial -95% Ingredientes Naturales- Aclara, Revitaliza…, 410
Hpc, Serum Ácido Hialurónico Facial+Vitamina B5+Extracto de Bulbo de Azafrán-99% Ingredientes Naturales-Hidratación Intensa…, 403
Hpc, Goodthreads - Playera Oxford de Manga Larga para Hombre, 16
Hpc, Just Home Bascula Corporal Digital Personal de Baño Cristal Templado Práctica Liviana Diagnostica Balanza Mide Peso para…, 107
Hpc, MAYBELLINE Labial liquido de larga duracion y no se transifere con acabado matte superstay matte ink coffee edition…, 264
Hpc, Andego Corrector de Postura Hombre Mujer - Cómodo y Eficaz Faja para Postura de Espalda Hombre para Combatir el…, 265
Hpc, Escala de Grasa Corporal, TYC Báscula Inteligente Bluetooth 4.0 Digital Analizador de Composición Corporal, 400 libras…, 157
Hpc, Nano Difusor Atomizador Sanitizante portátil Humidificador Desinfectante Alcohol Spray USB Recargable para Limpiar…, 120
Hpc, Oxímetro y Pulsómetro para Monitoreo de Saturación de Oxígeno y Latidos por Minuto con Pletismografía Saturación de…, 52
Hpc, Loxcell Nf Tabletas, 8
Hpc, Regio Papel Higiénico Luxury Almond Touch; Ligero Aroma A Almendras Y Hojas Dobles; Marca Regio 32 Rollos, color, 32…, 45
Hpc, Eos crema esfera coco coleccion primavera, 4
Hpc, L'Oreal Paris Mascara de pestanas a prueba de agua bambi false lash, l'oreal paris, 31
Hpc, HILBALM （Paquete 3）Gafas de Filtro de Luz Azul Lentes Antireflejantes Mujer y Hombres Gafa de Computadora para [Anti…, 238
Hpc, Vogue Esmalte de Unas Efecto Gel, color Amarillo Alegria, 14 ml, 2
Hpc, Maybelline Mascara para pestanas a prueba de agua false lash lift maybelline Negro a prueba de agua, 5
Hpc, Pluma de Acupuntura Electrónica, Uplayteck Pluma de Masaje de Energía de Acupuntura Meridian para el Alivio del Dolor y…, 6
Hpc, Maybelline Mascara para pestañas lavable false lash lift maybelline, 9
Hpc, Removedor de Espinillas - Pesoo Extractor de Puntos Negros Limpiador de Poros Exfoliante Facial Succionador de Puntos…, 21
Hpc, Oral-B 3D White Battery Power Electric Toothbrush, 1ct, (Color may vary), 22
Hpc, L'Oreal Paris Mascarilla Facial Anti-Imperfecciones Arcillas Puras, 48 ml, 325
Hpc, Isdin Protector Solar - 50 ml, 34
Hpc, L'Oreal Make Up Designer Paris Mascara de pestanas false lash bambi l'oreal paris Blackest Black, 4
Hpc, Accu Chek Active Tiras Reactivas, 1
Hpc, Garnier Men Limpiador facial matificante garnier men oil control 50ml, 34
Hpc, MAYBELLINE Maybelline Labial liquido de larga duracion y no se transifere con acabado matte superstay matte ink coffee…, 42
Hpc, Perry Ellis, 14
Hpc, Garnier Fructis H5537200 Mascarilla para Cabello Natural Vegana Anti Frizz con Fructis Hair Food, Verde, 350 ml, 42
Hpc, "LIFEED5 INMUNE 60 Cáps , 17
Hpc, Sonolife Oxímetro Digital de Pulso Tipo Dedo con Pletismografía, 218
Hpc, Oxímetro y Pulsómetro para Monitoreo de Saturación de Oxígeno Latidos por Minuto con Pletismografía Saturación de…, 61
Hpc, Gel Lubricante Vaginal, Sico Soft Lube Original, 56,7 g, 60
Hpc, Sico Piel con Piel - Condones Sin Látex Color natural, cartera con 9 piezas, 126
Hpc, Goodthreads Suéter de Cuello en V Marled Supersuave. Chamarra para Hombre, 8
Hpc, Soberbarmx Oxímetro de Dedo Monitor de saturación de oxígeno Monitor de oxígeno en Sangre Pulso del Dedo, 54
Hpc, La Roche Posay Effaclar Gel Purificante Gel Limpiador Facial para Piel Grasa, 400 ml, 69
Hpc, Suavitel Suavizante de Ropa Complete, Anochecer, 800 ml, 10
Hpc, Colour Me Spray, Gold Homme, 3 Fl. Oz, 15
Hpc, L'Oreal Paris Serum Ever Sleek sin Sulfatos, 118 ml, 32
Hpc, Playboy Condoms Twopack Mix&Play 2 latas con 10 condones cada una, 2
Hpc, Gel Limpiador Facial con Vitamina C + Vitamina E + Aloe Vera - 80% Ingredientes Naturales- Limpiador Profundo Facial…, 63
Hpc, Durex Condones Retardante con Benzocaína, Cartera con 18 Piezas, color, 18 count, pack of aquete de, 18 count, Paquete…, 24
Hpc, Remington Plancha de pelo de cerámica antiestática digital, Púrpura, NA, 24
Hpc, Pinol Detergente Líquido Pinol 2 L, Color, 2 Litros (L), Pack Of/Paquete De, 5
Hpc, Difusor de Aceites Esenciales - Pesoo 300ml Difusor Aromaterapia Difusores de Aromas Humidificador Aromaterapia…, 46
Hpc, Philips Norelco Bodygroomer BG7040/42 - skin friendly, showerproof, body trimmer and shaver with case and replacement…, 1
Hpc, Corrector de Postura - Pesoo Corrección de la Postura de Espalda para Mujeres, Hombres y Adolescentes Alivio del Dolor…, 36
Hpc, Blanqueador Dental de Carbon Activado de Coco en Polvo -100% Natural - Con Aceite Esencial de Coco, Naranja y Menta - No…, 22
Hpc, AXE Desodorante en Aerosol, DARK TEMPATION Para Hombre, 105gramos, 4
Hpc, Kleenex Cottonelle Beauty, Papel Higiénico, color Blanco, 18 Rollos x 180 Hojas Triples, 184
Hpc, "LIFEED5 HAIR & NAILS 60 Cáps , 27
Hpc, DOVE Jabón de tocador go fresh hidratación fresca 4 barras de 100 g c/u, 93
Hpc, Palmolive Palmolive Naturals Aceites De Almendra Y Omega 3 4x150 G, 10
Hpc, Kirkland - 6 Pack - Barba y Cabello - Tratamiento para 6 Meses., 24
Hpc, Nivea Deo Desodorante En Aerosol Para Hombre, Stress Protect, 150 Ml, 9
Hpc, Vichy Minéral 89 Contorno de Ojos - Gel con Ácido hialurónico y Cafeína pura, alisa, hidrata e ilumina, sin fragancia…, 187
Hpc, Eucerin Protector solar facial efecto mate toque seco Oil Control, , 50 ml, 24
Hpc, TECHVIDA Bluetooth Balanza de Grasa Corporal Digital Bluetooth 4.0 Inalámbrica Inteligente,59 datos Relacionados…, 218
Hpc, Kit Revitalift Ácido Hialurónico: sérum facial, crema día y crema de ojos. L'Oréal Paris, 64
Hpc, Lysol Gel Contra Bacterias Para Manos, color, 200 ml, pack of/paquete de, 8
Hpc, Amazon Essentials Polo de algodón con Punta de piqué. Camisa para Hombre, 8
Hpc, Philips Multigroom Series 3000 Set de Arreglo Personal 8 en 1 MG3730/15, 84
Hpc, Crema Corporal Palmolive Neutro Balance Líquida 400 ML, 24
Hpc, Lysol Gel Contra Bacterias Para Manos, color Verde, 200 ml, pack of/paquete de, 24
Hpc, Salvo Lavatrastes Líquido Limón y Botella Power Clean, 2.55 L ( Tres Botellas de 750ml + Una Botella de 300 ml), 58
Hpc, Maybelline Labial liquido de larga duracion y no se transifere con acabado matte superstay matte ink coffee edition…, 2
Hpc, Termómetro electrónico portátil para la axila de la Boca Pantalla Celsius Medición de Temperatura, 32
Hpc, Oral-B Pro-Salud Hilos Dentales 2x1 Multi-Beneficios 50 m, 3
Hpc, Sico Invisible Ultra Sense - Condones de Látex, Cartera con 9 Piezas, 11
Hpc, Condones de Látex Texturizados con Benzocaína, Sico Mutual Clímax, Cartera con 9 Piezas, 14
Hpc, Goodthreads Manga Corta índigo Henley Playera Henley para Hombre, 4
Hpc, Mennen Shampoo con Acondicionador, 700 ml, 4
Hpc, Finish Enjuague Líquido Abrillantador Rinse 2 Pack, color, 2PK x 400ml, pack of/paquete de, 1
Hpc, Gillette Fusion5 ProShield - Cuchillas de afeitar para hombre, Multicolor, 4 unidades, 14
Hpc, Aderogyl, 5 Ampolletas de 3ml, Vitaminas en Solución para la Prevención y el Tratamiento de la Gripe, 9
Hpc, CUBREBOCAS TRICAPA TERMOSELLADO PLISADO, 97
Hpc, Kids Headquarters Conjunto de Pantalones Cortos para niños de la sede Infantil, 7
Hpc, Gillette Prestobarba3 BodySense Máquinas Para Afeitar Desechables 4 Unidades, 81
Hpc, SAVILE Natural Shampoo Herbal 800ml, 25
Hpc, Onmedics Nano Difusor Atomizador Sanitizante Desinfectante En Spray Portátil Humidificador USB Recargable Para Limpiar…, 8
Hpc, Almohadilla de gel protector de juanetes mangas corrector Pad con gel separador Plancha 2 separadores de dedos…, 71
Hpc, Goodthreads Playera de Manga Larga de Ajuste estándar. Camisa de Botones para Hombre, 37
Hpc, Costalitos Fortiflex Colores Bolsas para Basura con Jareta, color Rosa/Blanco/Verde, Chico, 43 x 45 cm, 3
Hpc, Helly-Hansen HH LIFA - Playera térmica de Manga Larga con Cuello Redondo y Manga Larga, 14
Hpc, Cyxus Gafas de Filtro de Luz Azul para Computadora Lentes Transparentes para Mujer y Hombres Lente Antireflejantes, 11
Hpc, Palmolive Jabón De Tocador Palmolive Neutro Balance Dermo Purificante Líquido Corporal 390 Ml, Color, 390 Ml, Pack Of…, 1
Hpc, Persil Universal 5kg, 9
Hpc, Nivea Desodorante Antitranspirante Aclarado Natural Beauty Touch Roll On, 50ml, 2
Hpc, Curitas Transpiel Paquete Con 100 Venditas, 1 Pieza, Pack of 1, 2
Hpc, Escudo Antibacterial, Jabón de Tocador Protección con Vitamina E, 3 barras de 110gr, 2
Hpc, Nivea Men Desodorante Antitranspirante Hombre Stress Protect Spray, 150ml, 49
Hpc, Vanart Clásico Shampoo Hierbas 750 ml, 1
Hpc, Stefano Antitranspirante Black en Roll On para Caballero, 50 ml, 1
Hpc, Nivea Desodorante Antitranspirante Aclarado Natural Roll On, 50ml, 16
Hpc, Axion Detergente Lavatrastes Liquido Limon, 900 ml, 57
Hpc, Gaoye - Juego de 5 anteojos de lectura con bloqueo de luz azul, con bisagras, para mujeres y hombres, con filtro…, 7
